{
  "$schema": "http://json-schema.org/draft-07/schema#",
  "$id": "https://aer.sequence.org/schemas/v1/PhysicalDispute.schema.json",
  "title": "Spatiotemporal Bisection Dispute Proof Specification (3D Octree Merkle Path & Multimodal Conservation Verification)",
  "description": "Cryptographically authenticated evidence format resolving physical robotic task disputes via interactive 3D octree Merkle bisection paths and multimodal sensor telemetry conservation verification (AER Appendix C.1). Compresses volumetric telemetry to a single dispute voxel for sub-200k gas on-chain zero-knowledge verification.",
  "type": "object",
  "required": [
    "schema_version",
    "dispute_id",
    "task_id",
    "challenger_node_id",
    "defendant_node_id",
    "dispute_category",
    "spatiotemporal_voxel",
    "merkle_bisection_path",
    "sensor_telemetry_sample",
    "zk_snark_proof",
    "timestamp",
    "challenger_signature"
  ],
  "additionalProperties": false,
  "properties": {
    "schema_version": {
      "type": "string",
      "pattern": "^1\\.[0-9]+\\.[0-9]+$",
      "description": "Semantic versioning string of this formal schema specification (e.g. 1.0.0)."
    },
    "dispute_id": {
      "type": "string",
      "pattern": "^0x[a-fA-F0-9]{64}$",
      "description": "Unique 32-byte cryptographic identifier for the formal dispute proceeding."
    },
    "task_id": {
      "type": "string",
      "pattern": "^0x[a-fA-F0-9]{64}$",
      "description": "Target on-chain escrow contract identifier under dispute."
    },
    "challenger_node_id": {
      "type": "string",
      "pattern": "^0x[a-fA-F0-9]{40}$",
      "description": "EVM address of the complaining challenger asserting physical contract violation."
    },
    "defendant_node_id": {
      "type": "string",
      "pattern": "^0x[a-fA-F0-9]{40}$",
      "description": "EVM address of the executor node defending physical telemetry integrity."
    },
    "dispute_category": {
      "type": "string",
      "enum": [
        "SPATIAL_COLLISION",
        "MOTOR_TORQUE_ZERO",
        "GEOFENCE_BREACH",
        "ENERGY_CONSERVATION_VIOLATION",
        "SENSOR_MULTIMODAL_MISMATCH"
      ],
      "description": "Deterministic classification of physical or spatial conservation violation."
    },
    "spatiotemporal_voxel": {
      "type": "object",
      "required": [
        "voxel_coordinates",
        "timestamp_frame_ms",
        "frame_duration_ms"
      ],
      "additionalProperties": false,
      "properties": {
        "voxel_coordinates": {
          "type": "array",
          "items": { "type": "number" },
          "minItems": 3,
          "maxItems": 3,
          "description": "Disputed 3D spatial coordinate vector [x, y, z] in meters relative to reference spatial datum."
        },
        "timestamp_frame_ms": {
          "type": "integer",
          "minimum": 0,
          "description": "Temporal offset in milliseconds from execution commencement."
        },
        "frame_duration_ms": {
          "type": "number",
          "exclusiveMinimum": 0.0,
          "description": "Discrete temporal sampling window duration of the disputed telemetry frame."
        }
      }
    },
    "merkle_bisection_path": {
      "type": "array",
      "minItems": 1,
      "items": {
        "type": "object",
        "required": ["level", "sibling_hashes", "node_hash"],
        "additionalProperties": false,
        "properties": {
          "level": {
            "type": "integer",
            "minimum": 0,
            "maximum": 32,
            "description": "Hierarchical depth level within the 3D octree spatial decomposition."
          },
          "sibling_hashes": {
            "type": "array",
            "items": {
              "type": "string",
              "pattern": "^0x[a-fA-F0-9]{64}$"
            },
            "minItems": 7,
            "maxItems": 7,
            "description": "7 sibling octant hashes within the 8-ary spatial tree."
          },
          "node_hash": {
            "type": "string",
            "pattern": "^0x[a-fA-F0-9]{64}$",
            "description": "Composite node digest binding the octant leaf or intermediate branch."
          }
        }
      },
      "description": "O(log N) Merkle path isolating the specific spatial dispute voxel from comprehensive telemetry."
    },
    "sensor_telemetry_sample": {
      "type": "object",
      "required": [
        "se3_pose_matrix",
        "motor_current_amperes",
        "battery_delta_coulombs",
        "lidar_point_cloud_hash"
      ],
      "additionalProperties": false,
      "properties": {
        "se3_pose_matrix": {
          "type": "array",
          "items": { "type": "number" },
          "minItems": 16,
          "maxItems": 16,
          "description": "Homogeneous 4x4 SE(3) transformation matrix representing spatial position and orientation."
        },
        "motor_current_amperes": {
          "type": "array",
          "items": { "type": "number" },
          "minItems": 1,
          "description": "Discrete actuator electrical current measurements in Amperes."
        },
        "battery_delta_coulombs": {
          "type": "number",
          "description": "Integrated Coulomb charge differential over the frame sampling window."
        },
        "lidar_point_cloud_hash": {
          "type": "string",
          "pattern": "^0x[a-fA-F0-9]{64}$",
          "description": "SHA-256 cryptographic digest of the raw point cloud / depth array frame."
        }
      }
    },
    "zk_snark_proof": {
      "type": "object",
      "required": [
        "proof_circuit",
        "proof_points_a",
        "proof_points_b",
        "proof_points_c",
        "public_inputs"
      ],
      "additionalProperties": false,
      "properties": {
        "proof_circuit": {
          "type": "string",
          "maxLength": 64,
          "description": "Canonical on-chain verifier circuit identifier (e.g. PhysicalConservationDisputeVerifier_v1)."
        },
        "proof_points_a": {
          "type": "array",
          "items": { "type": "string", "pattern": "^0x[a-fA-F0-9]+$" },
          "minItems": 2,
          "maxItems": 2,
          "description": "G1 affine point A in Groth16 proof format."
        },
        "proof_points_b": {
          "type": "array",
          "items": {
            "type": "array",
            "items": { "type": "string", "pattern": "^0x[a-fA-F0-9]+$" },
            "minItems": 2,
            "maxItems": 2
          },
          "minItems": 2,
          "maxItems": 2,
          "description": "G2 affine point B in Groth16 proof format."
        },
        "proof_points_c": {
          "type": "array",
          "items": { "type": "string", "pattern": "^0x[a-fA-F0-9]+$" },
          "minItems": 2,
          "maxItems": 2,
          "description": "G1 affine point C in Groth16 proof format."
        },
        "public_inputs": {
          "type": "array",
          "items": { "type": "string", "pattern": "^0x[a-fA-F0-9]+$" },
          "description": "Public signals evaluated by the on-chain bilinear pairing precompile."
        }
      },
      "description": "Succinct zero-knowledge proof establishing that recorded telemetry mathematically violates physical conservation or boundary constraints."
    },
    "timestamp": {
      "type": "integer",
      "minimum": 1700000000,
      "description": "Unix epoch timestamp in seconds recording dispute initiation."
    },
    "challenger_signature": {
      "type": "string",
      "pattern": "^0x[a-fA-F0-9]{130}$",
      "description": "65-byte ECDSA cryptographic signature of the challenger asserting dispute evidence validity."
    }
  }
}
